id,label,common_names,short_description,delta_rules,sort_order,icon,is_active,source_type
NEUTRAL,Neutral,"[""Toes Forward"",""Straight Feet"",""Standard Angle""]",Feet are perfectly parallel and pointing straight ahead. Baseline score.,{},0,,TRUE,admin
TOES_OUT,Toes Out,"[""Duck Stance"",""Externally Rotated"",""Turned Out""]",Toes are angled outward. Opens the hips to engage inner thighs and inner calves.,{},1,,TRUE,admin
TOES_IN,Toes In,"[""Pigeon-Toed"",""Internally Rotated"",""Turned In""]",Toes are angled inward. Shifts focus to the outer sweeping muscles.,{},2,,TRUE,admin
HEEL_ELEVATED,Heel Elevated,"[""Wedges"",""Plantarflexed Bias"",""Cyclist Stance""]",Heels are raised on plates or wedges. Drives knees forward to isolate the Quads.,{},3,,TRUE,admin
TOES_ELEVATED,Toes Elevated,"[""Dorsiflexed Bias"",""Reverse Wedges""]",Toes are raised on plates. Deepens the stretch in the calves and hamstrings.,{},4,,TRUE,admin
