id,label,common_names,short_description,delta_rules,sort_order,icon,is_active,source_type
UNSUPPORTED,Unsupported,"[""Free Standing"",""No Brace"",""In Space""]",No external bracing. The body must provide all stability internally. Highest core/lower back demand.,"{""CURL"":{""CORE_DEEP"":0.1},""ROW_LOW"":{""CORE_DEEP"":0.25,""BACK_LOWER"":0.2},""ROW_MID"":{""CORE_DEEP"":0.25,""BACK_LOWER"":0.2},""ROW_HIGH"":{""CORE_DEEP"":0.25,""BACK_LOWER"":0.2},""EXT_OVERHEAD"":{""CORE_DEEP"":0.1},""PRESS_OVERHEAD"":{""CORE_DEEP"":0.2,""ABS_MIDDLE"":0.1}}",0,,TRUE,seed
SINGLE_LIMB_BRACED,Single-Limb Braced,"[""3-Point Stance"",""One Hand Braced"",""One-Arm Support""]",One limb (hand or foot) is used for balance. Reduces spinal load but still requires rotational core stability.,"{""CURL"":{""BICEP_INNER"":0.1,""DELTS_FRONT"":-0.15},""ROW_LOW"":{""CORE_DEEP"":-0.15,""BACK_LOWER"":-0.15},""ROW_MID"":{""CORE_DEEP"":-0.15,""BACK_LOWER"":-0.15},""ROW_HIGH"":{""CORE_DEEP"":-0.15,""BACK_LOWER"":-0.15}}",1,,TRUE,seed
DOUBLE_LIMB_BRACED,Double-Limb Braced,"[""4-Point Stance"",""Hand and Knee Braced"",""Two-Point Support""]","Two limbs are used for bracing (e.g., knee and hand on a bench). Provides high stability and eliminates most rotational demand.","{""ROW_LOW"":{""CORE_DEEP"":-0.25,""BACK_LOWER"":-0.2},""ROW_MID"":{""CORE_DEEP"":-0.25,""BACK_LOWER"":-0.2},""ROW_HIGH"":{""CORE_DEEP"":-0.25,""BACK_LOWER"":-0.2}}",2,,TRUE,seed
TORSO_BRACED,Torso Braced,"[""Chest Supported"",""Back Supported"",""Lying on Bench""]",The torso is fully supported by a pad or bench. Maximum isolation of the target muscles; core and lower back are completely offloaded.,"{""ROW_LOW"":{""CORE_DEEP"":-0.35,""BACK_LOWER"":-0.3,""LATS_UPPER"":0.1},""ROW_MID"":{""BACK_MID"":0.1,""CORE_DEEP"":-0.35,""BACK_LOWER"":-0.3},""ROW_HIGH"":{""CORE_DEEP"":-0.35,""BACK_LOWER"":-0.3,""BACK_UPPER"":0.1},""PRESS_FLAT"":{""CHEST_MID"":0.1,""CORE_DEEP"":-0.2,""TRICEP_OUTER"":0.05},""PRESS_INCLINE"":{""CORE_DEEP"":-0.2,""CHEST_UPPER"":0.1,""TRICEP_OUTER"":0.05}}",3,,TRUE,seed
ELBOW_FIXED,Elbow Fixed,"[""Preacher Pad"",""Elbow Braced"",""Arm Blaster""]",The elbows are pinned against a fixed surface. Eliminates all shoulder cheating and isolates the upper arm.,"{""CURL"":{""BRACHIALIS"":0.1,""BICEP_INNER"":0.15,""DELTS_FRONT"":-0.25},""EXT_OVERHEAD"":{""DELTS_FRONT"":-0.15,""TRICEP_INNER"":0.1},""EXT_PUSHDOWN"":{""DELTS_FRONT"":-0.15,""TRICEP_OUTER"":0.1}}",4,,TRUE,seed
LOWER_BODY_LOCKED,Lower Body Locked,"[""Leg Pads"",""Knee Brace"",""Seated with Pads""]",The lower body is mechanically locked down (like pulldown pads). Allows for force production exceeding body weight.,"{""PULL_FRONT"":{""CORE_DEEP"":-0.1,""LATS_LOWER"":0.15},""PULL_BEHIND"":{""CORE_DEEP"":-0.1,""BACK_UPPER"":0.15}}",5,,TRUE,seed
